name,sub_head,view_count,tel,tag,info,address,Latitude,Longitude
롯데시티호텔 명동,을지로와 명동 방문 후 호캉스 하기 좋은 호텔,1400,02-6112-1000,"롯데시티호텔, 롯데시티호텔명동, 명동호텔, 서울숙소, 숙박, 중구, 호텔","롯데시티호텔명동은 서울 시내 비즈니스와 쇼핑의 중심지인 명동과 서울의 오아시스인 청계천 사이에 위치하고 있으며, 27층 규모의 탁 트인 전망과 430의 객실과 뷔페 레스토랑, 미팅룸, 피트니스 등을 갖춘 프리미엄 비즈니스호텔이다.
성공적인 비즈니스와 만족스런 여행을 위한 최고의 실용성과 차별화된 서비스, 합리적인 가격으로 비즈니스 고객과 레저여행객 모두에게 잊지 못할 추억을 선사한다.",서울특별시 중구 삼일대로 362,37.5669364,126.988076
북촌마루한옥게스트하우스 [한국관광 품질인증/Korea Quality],새로운 인연이 기대되는 한옥 게스트하우스,1400,010-3253-8751,"서울숙소, 서울여행, 서울한옥, 숙박, 조식가능, 품질인증업소_전체보기, 한국관광품질인증, 한국관광품질인증_한옥, 한옥","북촌 마루 한옥게스트하우스는 서울 종로 북촌2경과 3경 사이 언덕에 위치한 2층 한옥이다. 아침에는 간편 한식 아침상을 즐기며 여러 나라 손님들과 이야기꽃을 피울 수 있고, 저녁에는 북촌마을에서 유일하게 있는 한옥 테라스에서 서울 시내 야경을 한눈에 볼 수 있다. 안국역에서 가까워 교통이 편리하고, 인근에 북촌 8경, 궁궐, 인사동, 청와대 등 주요 관광지가 있다.",서울특별시 종로구 창덕궁길 152,37.5831871,126.987524
연우하우스[한국관광 품질인증/Korea Quality],북촌한옥마을을 내려다보며 힐링~,1400,02-742-1115,"마운틴뷰, 서울숙소, 서울여행, 서울한옥, 숙박, 조식가능, 품질인증업소_전체보기, 한국관광품질인증, 한국관광품질인증_한옥, 한옥","""전통 한옥인 연우하우스는 서울 종로 북촌 한옥마을에 위치하여 조용하고 아늑하다.
아담한 두 개의 객실이 준비되어 있고, 객실에는 욕실을 갖추고 있다. 사다리를 타고 지붕으로 올라가서 보는 북촌 한옥마을의 전경이 일품이다. 오래된 한옥이기에 위생관리에 세심한 주의를 기울이고 있다. 인근에 경복궁, 청경궁, 창덕궁 등 서울 명소가 있다.""",서울특별시 종로구 북촌로12길 5-13,37.5823721,126.9853399
라마다 호텔앤스위트 서울남대문[한국관광 품질인증/Korea Quality],반려견과 함께하는 서울 나들이,1300,02-775-7000,"서울숙소, 서울여행, 서울호텔, 시티뷰, 애견동반숙소, 조식가능, 취사가능, 품질인증업소_전체보기, 한국관광품질인증, 한국관광품질인증_호텔, 호텔","라마다 호텔앤스위트 서울 남대문은 서울 중심부인 중구 순화동에 위치한다. 서울역과 시청역이 가까워 교통이 편리하고, 남대문시장, 명동, 광화문, 덕수궁 등 서울 주요 관광지를 도보로 즐길 수 있다. 주로 외국인 관광객과 호캉스 손님이 즐겨 찾는다. 다양한 고객층을 고려하여 여러 타입의 객실과 비즈니스센터, 레스토랑, 카페, 지하상가 등 편의시설을 운영한다. 반려견 동반 입실이 가능하나 별도 비용이 발생한다.",서울특별시 중구 칠패로 27,37.5601765,126.9720654
57명동호스텔[한국관광 품질인증/Korea Quality],"전 세계 여행자가 모이는 곳, 다양한 문화 교류의 공간",1300,"02-778-8835, 010-3262-3503","서울숙소, 서울여행, 서울호텔, 시티뷰, 조식가능, 품질인증업소_전체보기, 한국관광품질인증, 한국관광품질인증_호텔, 호텔","서울 중구 명동에 위치한 57명동호스텔은 호스텔 이름이 그대로 주소이기 때문에 기억하기 쉽다. 공항버스 하차 후 도보 5분, 명동역 도보 3분 거리에 있어 인근 관광지로의 이동이 매우 편리하고, 명동 쇼핑타운과도 가깝다. 싱글룸(개별욕실)이 있어 혼자 여행하거나 출장 온 사람에게도 인기가 많다. 조식과 커피, 차를 무료 제공하고 미니세탁기도 무료 이용이 가능하며, 각종 관광지와 문화공연 안내/예약 서비스도 제공하고 있다.",서울특별시 중구 명동2길 57,37.5609967,126.9834441
오클라우드호텔[한국관광 품질인증/Korea Quality],구름 위에 있는 듯한 그 느낌,1300,02-3480-8640,"서울숙소, 서울여행, 서울호텔, 숙박, 시티뷰, 조식가능, 취사가능, 품질인증업소_전체보기, 한국관광품질인증, 한국관광품질인증_호텔, 호텔","오클라우드호텔은 4성급 비즈니스호텔로, 서울 강남 한복판에 위치해 출장객이 머물기에 좋다. 객실은 스탠다드, 디럭스, 패밀리, 스위트 등 다양한 타입으로 구비되어 있고, 모던하고 청결해서 만족도가 높다. 객실마다 전자레인지, 와인잔, 다리미 등이 준비되어 있다. 지하 1층 레스토랑은 식사를 합리적인 가격에 제공한다. 2층에는 피트니스센터와 세탁실이 있고 옥상정원에서는 서울 도심의 야경을 즐길 수 있다. 비즈니스룸도 다양하게 구비되어 있다.",서울특별시 서초구 사평대로58길 12 오클라우드 호텔,37.5030575,127.0237944
힐하우스 호텔 [한국관광 품질인증/Korea Quality],서울 도심 여행자에게 딱 맞는 비즈니스호텔,1300,02-777-8135,"서울숙소, 서울여행, 서울호텔, 숙박, 품질인증업소_전체보기, 한국관광품질인증, 한국관광품질인증_호텔, 호텔","힐하우스 호텔은 서울 남산공원 아래에 위치한 비즈니스 호텔로, 깔끔하고 청결한 객실 컨디션으로 호평을 받고 있다. 모든 객실에서 무료 인터넷이 가능하고, 1층에 공용 전자레인지가 있다. 고객 편의를 위해 무료 짐 보관 서비스를 제공한다. 지하철 회현역, 서울역, 명동역이 주변에 있어 교통이 편리하고, 남산 서울타워, 남대문 시장 등 서울 도심 여행을 즐기기에 좋다.",서울특별시 중구 소공로3길 42 언덕의집,37.556805,126.9819591
레스케이프 호텔 (L’Escape Hotel),일상에서 무뎌진 감정과 설렘을 다시 깨우는 레스케이프호텔,1200,02-317-4000,"반려견동반여행지, 서울숙소, 숙박, 애견동반숙소, 중구, 호캉스즐기기","조선호텔앤리조트에서 선보이는 부티크 호텔, 레스케이프 호텔은 명동과 남대문 시장, 그리고 남산 등 서울의 상징적인 장소와 인접하며 도심 속에서 유럽의 감성을 느낄 수 있는 감각적인 호텔이다. 2020년부터 포브스 트래블 가이드에 추천 호텔로 3년 연속 선정된 것은 물론, 미쉐린 가이드 1스타에 선정된 컨템포러리 레스토랑 라망 시크레, 모던 차이니즈 레스토랑 팔레드 신까지 문화와 트렌드, 미식을 아우르는 라이프스타일 콘텐츠 플랫폼이기도 하다. 세계적인 인테리어 디자이너 Jacques Garcia의 손길이 닿은 아름다운 204개의 객실, 한 도시를 대표하는 레스토랑과 바의 철학을 담은 다이닝 공간을 갖추고 있다. 또한 프라이빗하게 즐기는 피트니스와 스파, 소규모 연회장이 있고, 2분 거리에 위치한 신세계 백화점과 면세점에서 쇼핑을 즐길 수 있다.",서울특별시 중구 퇴계로 67,37.5599039,126.9794911
프레이저 플레이스 센트럴 서울,KTX 서울역권에 위치한 숙소,1200,02-2220-8000,"반려견동반여행지, 서울숙소, 숙박, 애견동반숙소","대한민국 비즈니스와 문화의 중심지 KTX 서울역권에 있는 프레이저 플레이스 센트럴 서울은 스튜디오부터 펜트하우스까지 총 272개의 객실을 보유하고 있다. 비즈니스 고객과 젊은 레저여행객은 물론 가족 고객들을 위하여 실내 수영장과 어린이 풀장, 어린이 놀이방을 갖춘 프레이저 플레이스 센트럴 서울이다.",서울특별시 중구 통일로 78,37.5626123,126.9698765
누하당[한국관광 품질인증/Korea Quality],편백 베개와 도톰한 솜이불을 덮고 자는 하루,1200,"02-3391-0010, 010-4347-5768","서울숙소, 서울여행, 서울한옥, 품질인증업소_전체보기, 한국관광품질인증, 한국관광품질인증_한옥, 한옥","누하당은 100년이 넘은 고즈넉한 전통한옥으로, 조선시대부터 많은 선비와 예인이 살았던 서울 종로구 서촌에 위치한다. 모든 객실은 친환경 한지 벽지로 도배되었고, 도톰한 솜이불과 편백나무 베개가 여행자의 피로를 풀어준다. 아담한 정원이 있는 마당에서는 장구, 윷놀이, 한복체험 등 전통문화 체험이 가능하다. 서촌 거리를 걸으며 윤동주 하숙집, 박노수 미술관, 이상의 집 등 옛 정취를 느낄 수도 있다.",서울특별시 종로구 필운대로 49-7,37.5803458,126.9681457
더리버사이드 호텔,창 밖으로 펼쳐지는 야경의 운치와 아름다운 강남의 경관,1200,02-6710-1100,"강남호텔, 더리버사이드호텔, 서울숙소, 서울호텔, 서초구, 숙박, 호캉스, 호텔","서울 교통의 요지, 강남 비즈니스 권역의 중심지인 잠원동에 위치한 리버사이드호텔은 한강이 훤히 내려다보이는 조망을 갖췄으며 신사역에서 단 5분 거리에 위치해 지리적으로도 이점이 높은 호텔이다. 리버사이드호텔은 층별로 외식, 레저, 문화, 웨딩 등 다양한 서비스를 한강의 정취와 함께 동시에 즐길 수 있는 복합 문화 공간으로서 자리 잡고 있다. 한강이 내려다보이는 매력적인 야경을 가진 109개의 객실, 컨퍼런스를 위한 연회홀, 최고의 요리팀으로 구성된 복합 일식당, 맞춤형 피트니스 시스템과 럭셔리 스파센터, 인도어 골프연습장 등의 시설뿐 아니라 외국인 고객을 위한 24시간 전문 통역 및 영어권, 일어권 고객을 위한 사려 깊은 안내 등의 세심한 서비스를 통해 고객에게 편안한 휴식과 활기를 더해 주고 있다.
짜임새 있는 공간구성과 부족함 없이 준비된 객실 비품, 포근함과 안락함을 주는 인테리어로 완성된 더블룸은 고객에게 내 집과 같은 편안함을 주기 위한 리버사이드호텔의 마음이 담신 공간이다. 넉넉하고 여유로운 객실 공간, 세련된 실내 장식이 돋보이는 트윈룸은 한강의 여유와 정취를 객실로 담아와 여행, 비즈니스로 피로해진 고객에게 편안한 휴식을 선사한다.",서울특별시 서초구 강남대로107길 6,37.518644,127.0181008
인터컨티넨탈 서울코엑스,,1200,02-3452-2500,"강남구, 서울숙소, 숙박, 인터컨티넨탈서울코엑스","인터컨티넨탈 서울 코엑스는 대한민국의 트렌드가 시작되는 강남의 중심에서 쇼핑과 여가, 비즈니스를 한 번에 누릴 수 있는 모던하고 스타일리시한 비즈니스호텔이다. 한국 전통의 아름다움을 간직한 봉은사와 마주하고 있으며 코엑스몰, 카지노, 면세점과 바로 연결되어 쇼핑과 문화, 여가를 원스톱으로 즐길 수 있다.
아름다운 한강과 도심의 풍경을 한눈에 담을 수 있는 총 654개의 객실은 비즈니스와 여행에 최적화된 시설을 갖추고 있으며 새로운 개념의 LED조명으로 다양한 콘셉트와 세련된 분위기를 연출할 수 있는 하모니볼륨을 비롯한 총 11개의 연회장에서는 성공적인 모임을 준비할 수 있다.
또한 서울의 스카이 라인을 한눈에 담으며 식사를 즐길 수 있는 스카이라운지를 비롯해 한식, 중식, 일식, 인도식, 아랍식을 한 테이블에서 만나는 아시아 라이브 등 총 5개의 레스토랑&바에서 국내산 청정 로컬푸드를 이용한 다양한 미식을 즐길 수 있다.",서울특별시 강남구 봉은사로 524,37.5125207,127.0588194
코트야드 메리어트 서울 남대문,숭례문의 정취가 느껴지는 남대문 호텔,1200,02-2211-8000,"가족과함께, 남대문호텔, 서울숙소, 서울호텔, 수도권, 숙박, 친구와함께, 코트야드메리어트서울, 코트야드메리어트서울남대문, 호캉스","코트야드 메리어트 서울 남대문은 서울특별시 중심부에 들어선 첫 번째 코트야드 브랜드 호텔이다. 국보 1호 숭례문을 마주하고 있으며 남대문 시장, 명동과 인접성을 자랑한다. 지하철 2호선 을지로입구역 6번 출구에서 걸어서 약 5분이면 도착하는 편리한 위치를 자랑한다. 걸어서 5분 이내 거리에 롯데백화점 본점이 있다. 또한 청계천이 걸어서 약 10분, 명동거리까지는 도보로 약 5분, 다양한 공예품을 한자리에서 만나볼 수 있는 쌈지길까지 걸어서 약 20분이면 도착한다.
이호텔에서는 여행객들을 위해 공용 지역 무료 무선 인터넷, 발렛파킹, 카페 등을 포함한 다양한 시설과 서비스르 제공하고 있다. 그 밖에도 고급스러운 바, 룸서비스, 드라이클리닝, 무료 주차등으로 서울 고급 호텔만의 고품격 서비스를 항상 제공하고 있다.",서울특별시 중구 남대문로 9,37.5611902,126.9769246
반얀트리 클럽 앤 스파 서울,진정한 휴식이 있는 영혼의 안식처,1200,02-2250-8000,"반얀트리클럽앤스파서울, 서울숙소, 수도권, 숙박, 호텔","반얀트리 클럽 앤 스파 서울 (Banyan Tree Club & Spa Seoul)은 싱가포르의 세계적인 리조트 브랜드인 반얀트리 호텔 앤 리조트 그룹 (Banyan Tree Hotel & Resort Group)의 첫 번째 도심형 리조트이다. 멤버십 클럽 겸 호텔로 탁 트인 자연 속에서 휴식을 즐길 수 있는 도심형 리조트이자 럭셔리 비즈니스호텔이다. 7만 평방미터의 부지에 펼쳐진 반얀트리 클럽 앤 스파 서울은 서울의 중심인 남산에 위치하고 있으며 클럽, 호텔, 페스타 3개 건물과 다양한 야외 스포츠 공간으로 구성되어 있다. 이국적 풍경을 자랑하는 23개의 카바나를 갖춘 더 오아시스(야외 수영장), 사우나, 피트니스센터, 골프연습장, 테니스 코트, 풋살장, 스파, 키즈클럽 등 럭셔리하면서도 실용적인 시설로 바쁜 일상에서 벗어나 온전한 휴식과 프라이빗한 시간을 누릴 수 있다.
호텔 동에는 릴렉세이션풀(Relaxation Pool, 객실 내 미니 풀)을 갖춘 34개의 스위트급 객실을 보유하고 있으며 클럽 동에는 독특한 인테리어가 돋보이는 16개 클럽 객실을 갖추고 있다. 특히 호텔 최상 층에 위치한 두 객실뿐인 룸 ‘프레지덴셜 스위트(Presidential Suite)’는 서울 4계절의 아름다움을 가득 담은 남산과 서울의 야경이 3면 통유리를 통행 시원하게 펼쳐진다.",서울특별시 중구 장충단로 60,37.550263,127.0005365
서울한옥스테이(jnpstay)[한국관광 품질인증/Korea Quality],서울 도심 한가운데서의 전통놀이 체험,1200,0507-1309-6800,"독채한옥, 서울숙소, 서울여행, 서울한옥, 취사가능, 품질인증업소_전체보기, 한국관광품질인증, 한국관광품질인증_한옥, 한옥","서울한옥스테이는 jnpstay는 서울 경복궁역에서 도보 3분거리에 있는 독채 한옥 스테이로 프리이빗한 공간을 제공한다. 마당에서는 제기차기, 윳놀이, 투호놀이 등 전통 놀이를 즐길 수 있고, 테이블을 펴고 즐기는 바비큐는 한옥에서의 특별함을 더해 준다. 마당에서 하늘을 올려다 보고 살랑살랑 불어오는 바람을 느끼며 처마에서 떨어지는 빗방울을 바라보는 비멍이 바로 이곳에서 가능하다.",서울특별시 종로구 자하문로1나길 7-28,37.5769004,126.9708882
코리아나 호텔,,1100,02-2171-7000,"서울호텔, 숙박, 숙박시설, 숙박업소, 코리아나, 호텔, 휴식공간, 휴식여행, 휴식하기좋은곳, 힐링&여행","서울의 비즈니스와 관광의 중심인 광화문에 위치한 코리아나 호텔은 1972년 개관한 한국호텔의 역사를 주도해온 전통 있는 호텔로서 서울을 방문하는 비즈니스 출장객과 관광객에게 편리함을 제공한다.전통적인 한국의 미와 현대적인 느낌을 동시에 느낄 수 있는 코리아나 호텔에서는 역사의 정취를 느낄 수 있는 경복궁, 덕수궁 등의 고궁과 현대적인 느낌으로 재구성된 청계천, 광화문 광장을 배경으로 펼쳐지는 서울의 사계절을 볼 수 있다. 또한 고객의 편의를 충족시키기 위해 다양한 객실을 갖추고 있어 관광객은 물론 비즈니스 출장객의 니즈에 맞는 객실을 보유하고 있으며, 특히 2008년에 새 단장을 마친 이그젝티브 객실과 라운지는 고객 여러분의 성공적인 비즈니스를 위한 편안한 휴식처로 다양한 서비스를 제공하고 있다.
코리아나 호텔은 양식당, 중식당, 일식당 등 다양한 식음료 부대시설을 갖추고 있으며, 연회장을 보유하고 있고 고객 여러분의 행사규모와 목적에 맞는 다양한 형태의 연회 및 회의에 적합한 시설로 고객 맞춤화 서비스를 추구하고 있어 고객의 ‘Needs&Wants’에 맞는 서비스를 제공하고 있다. ‘내집 같다’라는 이야기가 투숙객들의 첫마디인 코리아나 호텔은 30년 이상 전통을 지닌 특급 관광호텔로서 고객에게 ‘편안함’을 모토로 삼고 있는 호텔업계의 선두주자라 하겠다. 지난 1988년 서울 올림픽 때는 올림픽 메인 프레스 센터 식당을 운영했으며 곧이어 개최된 장애자 올림픽에서는 선수촌 식당을 맡아 성공적으로 운영함으로써 당국 및 관계자는 물론 각국 선수, 임원들로부터 질 높은 음식과 종업원들의 친절한 서비스로 격찬을 받은 바 있다.",서울특별시 중구 세종대로 135,37.5683015,126.976646
JW 메리어트 호텔 서울(JW Marriott Hotel Seoul),오감을 감동시키는 특별한 럭셔리의 여정을 선사하는 JW 메리어트 호텔 서울,1100,02-6282-6262,"서울숙소, 숙박","JW 메리어트 호텔 서울이 대대적인 리노베이션을 통해 가장 세련되고 품격있는 럭셔리 호텔로 재탄생했다. 세계적인 인테리어 디자이너들이 대거 참여하여 한국의 미를 담아 창조한 웅장하고 세련된 공간, 저명한 식음 컨설턴트들과 국내외 최고 쉐프들이 선보이는 독창적이고 품격 높은 미식 경험, 옛부터 뿌리깊게 내재된 한국인의 공경심과 배려심에서 우러나오는 섬세하고 진정성 있는 서비스, 고객의 취향에 맞춘 다양한 엔터테인먼트와 심신의 건강을 케어해주는 웰니스 프로그램 등으로 고객이 열망하는 그 이상의 재미와 감동, 잊지 못할 추억을 만들어 주는 진정한 럭셔리의 정수를 선보인다.",서울특별시 서초구 신반포로 176,37.5043637,127.0036211
교대게스트하우스[한국관광 품질인증/Korea Quality],아늑한 분위기의 게스트하우스,1100,"02-3486-7373, 010-7390-5901","게스트하우스, 서울게스트하우스, 서울숙소, 서울여행, 품질인증업소_전체보기, 한국관광품질인증, 한국관광품질인증_게스트하우스","교대게스트하우스는 서울 교대역 인근의 서초삼성래미안 아파트 내에 있다. 주로 인근 학원에서 공부하기 위해 한국을 방문하는 외국인 학생이 장기간 머물곤 한다. 일반 가정집 내의 일부 공간으로, 두 개의 객실이 각각 분리되어 있고, 각 방에는 컴퓨터와 책상이 있다. 주방과 욕실, 거실과 TV, 소파는 함께 사용하고, 세탁은 무료로 제공된다.",서울특별시 서초구 사임당로17길 116 서초삼성래미안아파트,37.4932689,127.0196731
스테이 데이 오프 [한국관광 품질인증/Korea Quality],마당과 한옥을 바라보며 노천욕을 즐길 수 있는 곳,1100,0504-0904-2406,"독채한옥, 서울숙소, 서울여행, 서울한옥, 조식가능, 품질인증업소_전체보기, 한국관광품질인증, 한국관광품질인증_한옥, 한옥","스테이데이오프는 서울 경복궁 서쪽마을 서촌 먹자골목 뒤편에 위치한 한옥스테이다. 지하철 3호선 경복궁역에서 도보 5분 거리에 있어 대중교통의 접근성이 뛰어나다. 객실은 본채와 별채로 나뉘는데, 본채는 퀸사이즈 침대가 놓인 침실 2개, 거실 겸 주방, 화장실 2개로 구성되어 있다. 별채의 특별함은 시원한 통창 안으로 반신욕을 할 수 있는 욕조와 사우나가 있다는 것이다. 주중에 이틀 넘게 묵으면 숙박비를 10% 할인해준다.",서울특별시 종로구 자하문로1다길 6,37.5772819,126.9711474
대우모텔[한국관광 품질인증/Korea Quality],1인 여행자를 배려한 싱글룸이 여기에!,1100,02-755-8067,"서울숙소, 서울여행, 서울호텔, 조식가능, 품질인증업소_전체보기, 한국관광품질인증, 한국관광품질인증_호텔, 호텔","대우모텔은 서울 중구 북창동에 자리한다. 도보 10분 이내 거리에 서울광장, 덕수궁, 명동 쇼핑가, 다양한 식당이 있어 여행에 편리하다. 2013년 리모델링을 통해 새롭게 단장해 깔끔하고 고객 편의를 위해 객실 내 다양한 편의시설을 갖췄다. 무료 조식과 수하물 보관, 세탁, 팩스/복사 서비스를 제공한다.",서울특별시 중구 세종대로14길 22-2,37.5627386,126.9778894
한옥 게스트하우스 동촌재 [한국관광 품질인증/Korea Quality],경복궁의 서쪽 마을에 위치한 마당이 있는 한옥,1100,"010-8561-5227, 010-9127-5227","게스트하우스, 서울게스트하우스, 서울숙소, 서울여행, 서울한옥, 조식가능, 품질인증업소_전체보기, 한국관광품질인증, 한국관광품질인증_게스트하우스, 한옥","동촌재는 서울 종로 서촌에 자리한 한옥 게스트하우스로, 안채를 숙박공간으로 사용한다. 안채는 객실 4개와 대청마루, 주방, 화장실로 구성되어 있다. 화장실은 뒷마당에도 있다. 취사는 불가하지만 즉석식품 정도는 먹을 수 있고, 외부 음식 반입도 가능하다. 무료 조식을 제공하고, 마당이나 대청에서 영화감상이 가능하며, 냉장고와 세탁기를 이용할 수 있다. 야간 한양도성 탐방, 다도, 떡만들기 등 체험 프로그램을 운영한다.",서울특별시 종로구 자하문로11길 21-10,37.5800576,126.9697694
더 플라자 (THE PLAZA),마음을 편하게 해주는 숙소,1100,02-771-2200,"서울숙소, 서울호텔, 수도권, 숙박, 숙박시설, 숙박업소, 플라자호텔, 휴식공간, 휴식여행, 휴식하기좋은곳","더 플라자 호텔은 국내 최고의 Boutique Hotel이다. 호텔 곳곳에 베어있는 감성적인 디자인 미학(美學)과 고객 동선 하나하나에 스며 있는 섬세한 서비스, 국제 비즈니스 도시 서울의 편리(便利)를 모두 갖춘, 스타일과 편리를 추구하는 현대 비즈니스맨을 위한 ‘완벽한 호텔’을 지향하고 있다. 플라자호텔은 각 기업들의 본사 이외 은행본점들이 밀집한 시내교통 한 중심에 위치하여, 남대문과 각 쇼핑센터 등의 연계로 비즈니스 손님들 뿐만 아니라 관광객에게도 편리함을 제공하고 있다. 또한 시청을 정면으로 두고 위치해 멀리 청와대까지 바라볼 수 있는 장관을 연출하고 있다.",서울특별시 중구 소공로 119,37.5646699,126.9779134
