name,sub_head,view_count,tel,tag,info,address,Latitude,Longitude
웨스틴 조선 서울,서울 최고의 비즈니스 호텔,1100,02-771-0500,"가족과함께, 서울숙소, 서울호텔, 숙박, 연인과함께, 웨스틴조선호텔, 친구와함께, 호캉스","비즈니스와 쇼핑의 최적지인 서울의 심장부에 위치한 특 1급 호텔로, 각국의 대사관, 은행, 정부부처, 고궁과 백화점과 명동에 인접한 곳에 자리하고 있다.
1914년 개관한 현존하는 한국 최고(最古)의 호텔로서 100여 년의 전통이 만들어낸 품격 높은 서비스와 현대적 시설, 도심이라는 위치적 편의성 등으로 세계적인 여행, 금융 잡지에서 서울 최고의 비즈니스 호텔로 인정받고 있다.
SIMMONS사에서 제작한 세계특허 포켓스프링으로 만든 매트리스와 웨스틴의 거위털 듀뱃의 만남으로 ‘천상의 편안함을 제공하는 꿈의 매트리스를 사용하고 있다. 인체 곡선을 따라 따로따로 움직이는 포켓스프링이 인체를 완벽하게 받쳐주며, 특별 제작된 필로우 톱 매트리스가 깔려 침구가 몸을 감싸는 듯한 포근함을 선사한다.
전통의 스시 명가 스시조, 건강한 광동식 중식을 선보이는 홍연, 오페라의 영혼을 느낄 수 있는 라이브 뷔페 아리아, 모던 이탈리안 오스테리아 루브리카, 나인스 트 와인 & 다인, 총 5개의 레스토랑과 조선델리 스위트 기프트 & 파티세리와 오픈형 라운지 & 바에서 국내 최고의 미식을 즐길 수 있다.
웨스틴 조선 서울의 연회 시설로는 대연회장인 그랜드 볼룸과 중, 소연회장이 있습니다. 그랜드 볼룸은 최대 450명까지 수용이 가능하며, 최상급 스피커, 8개의 스크린, 182대의 라이트와 콘솔로 다양한 행사를 연출할 수 있다. 환구단의 아름다움을 만끽할 수 있는 중, 소연회장은 최대 200명의 연회가 가능하며, 다양한 성격의 연회 진행이 가능하다.",서울특별시 중구 소공로 106,37.5644378,126.9800994
소소하우스[한국관광 품질인증/Korea Quality],서촌 골목 감성과 한옥의 편안함을 누릴 수 있는 곳,1100,010-5286-0704 / LINE : soso-house,"독채한옥, 서울숙소, 서울여행, 서울한옥, 조식가능, 취사가능, 품질인증업소_전체보기, 한국관광품질인증, 한국관광품질인증_한옥, 한옥","소소하우스는 서울 종로구 서촌에 위치한 독채 한옥스테이다. 대문에 들어서면 돌을 깔아놓은 자그마한 마당과 알프스 사과나무가 반갑게 맞이하고, 마당 한쪽에는 걸상이 있어 차 한잔의 여유를 즐기기에 좋다. 대청마루를 중심으로 양편에 안방과 주방이 있는데, 안방에는 다락이 딸려 있다. 취사가 가능하고 조식으로 빵과 샐러드, 커피가 제공되며, 과일청과 차 등도 서비스로 제공된다. 도보로 경복궁, 서울역사박물관, 박노수미술관 등으로 이동할 수 있다.",서울특별시 종로구 필운대로5가길 16-5,37.5802778,126.9681561
모텔 B,여행 속 쉬어가는 공간,1100,02-734-7725,"서울숙소, 숙박","서울 서대문역 5번출구에 있는 모텔비는 서울의 중심 중구에 위치하고 있다. 강북삼성병원과 서울적십자병원이 길건너에 있어 병원을 이용하려는 고객들에게도 인기가 좋으며 시청을 비롯한 관공서들이 많아 비즈니스로 서울을 찾는 분들에게도 편안한 쉼터가 된다.
모텔 옆 정동길을 따라 덕수궁 돌담길의 산책은 아름다운 추억을 만들기에 충분하고 주변관광지로는 경희궁, 서울역사박물관, 정동길, 덕수궁등이 있으며 서울 중심권에 즐비한 대형백화점과 대형쇼핑몰에서의 즐거운 쇼핑을 즐길 수 있다.",서울특별시 중구 새문안로 28-1,37.5676904,126.9689262
서울올림픽파크텔,청소년과 체육인에게 특화된 호텔,1100,02-410-2114,"국민체육진흥공단, 서울숙소, 서울올림픽파크텔, 송파구, 숙박, 올림픽파크텔","서울올림픽파크텔은 1988년 제24회 서울올림픽대회의 성공적인 개최를 기념하고, 대회 유산을 효율적으로 활용하기 위해 국민체육진흥공단정관에 따라 1990년에 설립되었다. 서울 송파구 잠실 소재의 올림픽공원 내에 위치하고 있어 객실에서 울창한 숲과 호수를 조망할 수 있으며, 이용객의 편의를 위한 다양한 부대시설도 갖추고 있다. 특히 청소년과 체육인에게 특화된 호텔로 보다 편리하고 저렴하게 이용할 수 있다.
서울올림픽파크텔은 세계 5대 조각 공원 중 하나이며, 43만 평 규모의 아름다운 경관을 가지고 있는 올림픽공원과 더불어 성공적인 비즈니스를 위한 맞춤 공간으로 고객에게 사랑받고 있다. 대규모 국제 대회, 세미나, 다양한 규모의 연회에 이르기까지 어떠한 행사도 성공적으로 이끌 수 있는 최적의 장소이다.
도심 속 푸른 섬 올림픽공원은 스포츠 콤플렉스(2023년 완공), KSPO DOME 등 KPOP 콘서트·대규모 공연장과 특화된 5곳과 88 잔디마당, 지구촌공원, 피크닉장, 음악 분수가 있는 수변 무대 등 4곳의 다양하고 넓은 이벤트광장이 있어 연회 행사 개최의 최적의 공간을 보유하고 있다.",서울특별시 송파구 올림픽로 448,37.5210311,127.1161652
The-K호텔서울 (더케이호텔서울),"현대 도시인들이 문화와 예술, 자연이 함께 어우러진 공간 속에서 프레시 업(Fresh Up) 할 수 있는 새로운 휴식 문화 공간",1000,02-571-8100,"서울숙소, 숙박","서초구 양재동에 위치한「The-K호텔서울」은 현대 도시인들이 문화와 예술, 자연이 함께 어우러진 공간 속에서 프레시 업(Fresh Up) 할 수 있는 새로운 휴식 문화 공간, ‘The Real Urban Resort’를 표방하는 프리미엄 호텔이다.
3만 2천여 평(105,000㎡)의 넓은 면적을 자랑하며, 250실의 다양한 객실과 아트홀, 대연회장, 컨벤션 센터, 애비뉴(별관)으로 구성되어 있으며 29개의 대·중·소규모 연회장을 보유하고 있어 여러 회의가 동시에 진행되는 국제행사를 비롯하여 의학 학술 세미나 등 다양한 행사 진행의 명소로 각광받고 있다. 신분당선 양재시민의 숲(매헌) 역에서 5분 거리에 있어 대중교통이 용이하며, 3호선 양재역에서는 호텔 셔틀버스를 이용하시면 편리하게 호텔로 이동할 수 있다. 또한 경부고속도로 양재 IC와 3분 거리에 근접해 있으며 인천공항에서 호텔 로비까지 한 번에 이동할 수 있는 공항리무진버스를 이용할 수 있어 각종 행사 시 편리한 교통으로 접근이 뛰어나다는 이점을 가지고 있다. 뿐만 아니라 1,200여 대를 동시에 수용할 수 있는 지상과 지하 주차시설을 모두 완비하고 있어 여유롭고 편리하게 행사를 진행할 수 있다.",서울특별시 서초구 바우뫼로12길 70,37.4667729,127.0328158
롯데호텔서울,"명동, 을지로, 청계천 등 서울의 중심 관광지들로의 접근성이 뛰어나
서울 관광을 위한 최적의 위치를 자랑하는 롯데호텔 서울",1000,02-771-1000,"서울숙소, 숙박, 중구, 호캉스즐기기","서울의 중심에 위치한 롯데호텔서울은 1,015실 규모를 갖춘 한국 최고의 럭셔리 호텔이다. 네 개의 세계적인 인테리어 회사들이 참가하여 설계한 독창적인 본관 객실은 최신 트렌드를 반영하며 성공적인 비즈니스를 위한 최적의 공간이다. 2018년 9월 리뉴얼된 이그제큐티브타워는 한층 더 정교한 서비스와 세계적인 인테리어 회사 “GA”가 설계한 품격 있는 공간으로 재탄생하여 럭셔리 호텔의 새로운 지평을 열어갈 것이다.
또한, 롯데호텔서울은 각종 공공기관과 가까운 위치에 있으며 백화점과 면세점이 같이 위치하여 편리성을 자랑한다. 품격 있는 가족 모임과 럭셔리 웨딩을 위한 최상의 장소를 제공하고 있으며, 최고급 레스토랑을 갖추고 있어 국빈 등 VIP 고객을 모시기에 최적의 공간을 제공한다.",서울특별시 중구 을지로 30 롯데호텔,37.5653778,126.9813558
루민북촌[한국관광 품질인증/Korea Quality],한옥 체험을 원하는 외국인 여행자는 이곳으로!,1000,070-8098-4497,"독채한옥, 서울숙소, 서울여행, 서울한옥, 취사가능, 품질인증업소_전체보기, 한국관광품질인증, 한국관광품질인증_한옥, 한옥","루미북촌은 서울 가회동 북촌한옥마을 인근 주택가에 있는 독채 한옥 숙소로, 7평이라 크지 않지만 2인이 머물기에 충분하다. 발뮤다 토스터기와 인덕션 등을 갖춘 주방과 샤워가 가능한 화장실, 빔프로젝터를 갖춘 침실까지 어느 것 하나 불편함이 없도록 준비돼 있다. 아로마 브랜드의 어메니티와 숙소 근처 유명 카페의 드립백 커피 등도 비치되어 있고 세탁기 이용도 가능하다. 인근에 고궁, 인사동, 한옥마을 등 주요 관광지가 있다.",서울특별시 종로구 북촌로11길 13-12,37.5815085,126.9841276
보안스테이(BOANSTAY),,987,boanstay@gmail.com,숙박,"2007년부터 예술공간으로 운영되어온 ‘통의동 보안여관’은 본래 1942년부터 2005년까지 약 60년간 수 많은 나그네들이 머물다간 쉼의 공간이었다. 잠시 멈춰졌던 장소의 고유한 기능을 되살리며 한국 근대문학의 주요 거점 중 하나였던 보안여관의 문화적 유산을 이어 2017년, 문화를 생산하고 향유하는 크리에이터들을 위해 ‘보안스테이’는 새롭게 문을 열었다. 카페(33마켓), 서점(보안책방), 전시 공간(보안1942)이 포함된 복합문화예술공간 보안1942의 3,4층에 위치한 보안스테이Boanstay는 컬쳐 노마드들을 위한 가장 이상적인 임시 거주의 형태를 구현하고자 만들어졌다. 서울의 교통 요지이자 문화, 역사의 중심지인 서촌에 자리한 보안스테이는 도시의 스카이라인과 대조를 이루는 북악산과 경복궁, 청와대, 서촌의 한옥 등 주변의 특색있는 풍경을 감상할 수 있는 매력적인 전망을 지니고 있으며 내부 객실은 휴식과 이완을 극대화 시킬 수 있는 간결하고 절제된 구조와 색감을 바탕으로 한국을 대표하는 현대 예술가와 디자이너의 작품과 가구로 구성되어 있다.",서울특별시 종로구 효자로 33,37.5790439,126.9736188
명동게스트하우스 꼬모 [한국관광 품질인증/Korea Quality],서울 도심 전경을 파노라마로 감상할 수 있는 곳,986,02-755-5437,"게스트하우스, 서울게스트하우스, 서울숙소, 서울여행, 조식가능, 품질인증업소_전체보기, 한국관광품질인증, 한국관광품질인증_게스트하우스","꼬모는 서울 지하철 명동역에서 도보 3분 거리에 위치한 게스트하우스로, 외국인 여행객이 특히 많이 찾는다. 객실은 1인 여행객부터 가족 여행객까지 아우를 수 있도록 다양하게 준비하였고, 객실마다 개별 화장실 겸 욕실을 갖춰 편의성을 높였다. 영어와 중국어에 능통한 스태프가 있고 짐 보관 서비스를 무료로 제공한다. 차량 10분 거리에 남산서울타워, 숭례문, 남대문시장 등 주요 관광지가 있다.",서울특별시 중구 퇴계로24길 12,37.5604179,126.987208
노보텔 앰배서더 강남,"프랑스풍 특1급 호텔로 전세계 400여 개의 노보텔 체인 중 하나로
세계적인 브랜드에 걸맞은 고품격 서비스와 시설을 자랑한다.",977,02-567-1101,"강남구, 서울숙소, 숙박","서울 경제의 중심지인 강남에 위치한 노보텔 앰배서더 강남에는 귀빈실 8개와 안락한 객실 332개 그리고 커피숍, 로비 라운지, 일식당, 펍 레스토랑, 뷔페식당과 함께 세미나, 회의, 칵테일 리셉션 등 모든 종류의 연회를 유치할 수 있는 연회장 4개가 있다. 또한 24시간 이용할 수 있는 비즈니스센터와 호텔 내에 어디서나 이용 가능한 고속 인터넷 무선 랜카드, 첨단 시설을 갖춘 수영장, 골프 레인지, 체련장, 사우나, 에어로빅 룸과 조깅 트랙 등을 갖춘 헬스클럽이 운영되고 있다.
로비에 들어서면 눈앞에 펼쳐지는 로비라운지의 폭포수가 여름에는 시원함을 겨울에는 아름다운 설경을 선사한다. 푹신한 소파에서 커피, 칵테일, 차 등 각종 음료와 함께 다양한 디저트를 골라 드실 수 있으며 간단한 아침식사도 제공하고 있다. 또 낮에는 조용한 분위기에서 비즈니스 만남을, 저녁에는 감미로운 라이브 연주와 함께 아늑한 분위기를 만끽할 수 있다.
서울을 찾은 관광객과 비즈니스맨을 위해 적합하게 설계된 객실들은 세련되고 깨끗한 분위기를 자랑하며 한층 여유롭고 쾌적한 공간으로 품격 있는 서비스를 제공한다. 특히 노보텔 스위트룸의 편안하고 안락한 침실 내의 욕실에는 자쿠지(Jacuzzi)욕조가 있어 업무 후 편안한 휴식을 도와준다. 또한, 24시간 이용 가능한 비즈니스 센터, 호텔 내 어디서나 이용 가능한 초고속 인터넷 무선 랜카드와 최첨단 시설을 갖춘 수영장, 골프 연습장, 체련장, 사우나, 에어로빅 룸과 조깅 트랙 등을 갖춘 헬스 클럽이 06:00 ~ 22:00 까지 운영되고 있다.
COEX 무역 센터, 경부 고속도로와 인접해 있으며 인천 국제 공항의 이용에도 용이한 위치해있는 노보텔 앰배서더 강남은 고객의 보다 나은 편의를 위해서 항상 최선을 다하고 있다.",서울특별시 강남구 봉은사로 130,37.5053029,127.0288672
JW 메리어트 동대문 스퀘어 서울,한국의 아름다움을 느낄 수 있는 호텔,977,02-2276-3000,"서울숙소, 숙박, 종로구","서울의 엔터테인먼트, 문화, 상업이 융합되는 다이나믹한 동대문에 위치한 JW 메리어트 동대문 스퀘어 서울(JW Marriott Dongdaemun Square Seoul)은 서울에서 두 번째로 선보이는 JW 메리어트(JW Marriott) 호텔이다. 스위트 룸 15개를 포함한 객실 170개, 수영장, 24시간 피트니스 센터, 풀 서비스 스파를 갖추고 있는 JW 메리어트 동대문 스퀘어 서울에서 고객들은 편안한 휴식을 즐길 수 있다. 메리어트 동대문 스퀘어 서울의 그랜드 볼룸에서는 모던하면서 품위 있는 공간에 98개의 삼성 LFD(Large Format Display)로 연결된 첨단 미디어 월(Media Wall)로 성공적인 프레젠테이션 및 기업 연회, 이벤트 등이 가능하며 4개의 다양한 미팅 룸이 준비되어 있다. 또, 고객들은 세계적인 명성을 자랑하는 스테이크하우스 BLT Steak를 비롯해 올 데이 다이닝을 즐길 수 있는 Tavolo 24, The Lounge, The Griffin Bar, Seoul Baking Company에서 최고의 미각 체험을 할 수 있다. 특히, 쇼핑 마니아들은 26개의 쇼핑 몰과 3만여 개의 전문 샵들로 구성된 한국의 가장 큰 쇼핑 지역에 자리 잡은 호텔을 마음껏 즐기게 될 것이다.",서울특별시 종로구 청계천로 279,37.5703941,127.0089126
"조선 팰리스 서울 강남, 럭셔리 컬렉션 호텔 (Josun Palace, a Luxury Collection Hotel, Seoul Gangnam)","서울의 미래를 이끄는 강남의 새로운 럭셔리가 시작되는 곳, 조선 팰리스. 한국 최초의 럭셔리 호텔인 조선호텔이 조선 팰리스로 그 최초의 의미를 이어간다.",969,02-727-7200,"5성호텔, 강남호텔, 숙박, 이타닉가든, 조선팰리스, 콘스탄스뷔페, 테헤란로호텔, 호캉스","조선 팰리스 서울 강남, 럭셔리 컬렉션 호텔(이하 조선 팰리스)은 한국 최고의 럭셔리 호텔이었던 초기 조선호텔의 장인정신을 바탕으로 지난 100여 년동안 지녀온 헤리티지를 계승해 조선호텔앤리조트가 첫 선을 보이는 최상급 독자 브랜드 호텔이다. 또한 한국 최초로 메리어트 인터내셔널의 유니크하면서도 역사적인 럭셔리 호텔 브랜드인 ‘럭셔리 컬렉션’(The Luxury Collection)과 소프트 브랜드 제휴를 맺어 대한민국 첫 번째로 오픈한 럭셔리 컬렉션 호텔이다.
지하 6층, 지상 36층 규모에 총 254 객실을 보유하고 있으며 파노라마 뷰, 도심 속의 스카이라인 뷰를 느낄 수 있다. 객실 타입은 총 9개로, 전 객실에 스웨덴 명품 브랜드 바이레도 제품 어메니티가 제공되며, 에어 드레서, 캡슐 커피 머신이 비치되어 있다. 전 객실 그랜드 리셉션에서 커피 및 쿠키가 제공되고, 객실 타입에 따라 다양한 혜택이 포함되어 있어 조선 팰리스만의 럭셔리한 라이프를 즐길 수 있다. 고객 한 분 한 분에게 맞춤형 서비스를 선보일 그리팅 장소인 그랜드 리셉션, 최상의 컨디션 속에서 서울의 시티뷰를 조망할 수 있는 총 254개의 객실, 콘스탄스(Constans), 이타닉 가든(Eatanic Garden), 더 그레이트 홍연(The Great Hong Yuan), 1914 라운지 & 바, 조선델리 더 부티크 등 총 5개로 구성된 독보적인 고메 컬렉션, 최대 300 명이 한번에 이용할 수 있는 더 그레이트 홀을 비롯한 3개의 연회장, 럭셔리 웰니스를 완성해줄 수영장 및 피트니스 시설로 구성되어 있다.
조선 팰리스는 호스피탈리티 업계의 신진 디자이너로 명성을 떨치며 전세계적으로 주목받고 있는 움베르트&포예(Humbert&Poyet)가 디자인 설계를 맡았다. 두 디자이너는 럭셔리에 대한 정의를 통해 최상위 호텔 브랜드의 다층적인 미를 완성시켰다. 미적 완성도뿐 아니라 조선 팰리스는 시그니처 향인 라스팅 임프레션(Lasting Impression)을 개발해 오감의 다각적인 요소를 채웠다. 긴 시간 동안 겹겹이 쌓인 조선의 스토리를 향을 통해 다층적으로 느낄 수 있도록 고안했으며 그윽하게 농축되어 신비롭고 우아한 조선 팰리스의 향은 호텔 로비에 들어선 순간부터 배웅의 시간까지 고객의 여정을 함께해나가고 있다. 한편 조선 팰리스는 ‘위드 코로나’ 시대에 고객들을 위한 객실 내 서비스들을 다각적으로 도입했다. 전 객실 내 자동 UVC 살균장치를 도입해 객실 정비 후 자동으로 자외선 살균시스템이 작동된다. 공기청정, 가습기능 역시 객실 내부 필터로 장착되어 객실 컨디션을 쾌적한 상태로 유지하며, 전 객실에 공기청정기를 추가로 설치해 놓았다. 더불어 전 객실 설치된 에어드레서를 통해 고객들의 의류 컨디션까지 최상으로 보장해 나가고 있다. 또한, 문자나 IT 기기들에 친숙한 MZ 세대들의 눈높이에 맞춰 체크아웃 절차에서부터 객실 내에서의 모든 서비스 부분을 객실 내 스마트 TV와 Tablet PC를 통한 컨시어지 기능으로 구현해 비대면 서비스 옵션을 강화했다.",서울특별시 강남구 테헤란로 231,37.5032113,127.0414917
캘리포니아 관광호텔,계속 누리고 싶은 가족같은 편안함을 제공하는 곳,968,02-401-4653~5,"서울숙소, 송파구, 숙박","송파구 가락동에 위치한 캘리포니아호텔은 잠실롯데월드, 올림픽공원, 코엑스, 도심 공항 터미널, 잠실경기장 등이 근거리에 위치하여 비즈니스, 스포츠, 문화의 중심에 있다. 지리적으로 편리한 캘리포니아호텔은 다양한 쇼핑과 볼거리를 위해 근처 주요 시설로 쉽게 이동할 수 있다는 장점을 가졌다. 이 때문에 사업차 방문하는 비즈니스맨뿐만 아니라 쇼핑과 레저를 즐기러온 관광객에게 높은 만족을 제공하고 있다.
객실은 보다 현대적인 감각으로 안락하게 꾸며져 있으며 다양한 콘셉트로 고객 취향에 한 걸음 더 다가가고자 노력했다. 고품격 인테리어와 차원이 다른 서비스로 고객 감동 그 이상을 맛볼 수 있을 것이다. 또한 투숙객들의 다양한 취향을 충족시키기 위하여 마사지 기능을 갖춘 바디샤워기와 넓고 편한 최신형 월풀욕조, 위생관리를 위한 자외선 살균기, 공기 청정기 등을 갖추고 있으며 고객이 편안하게 즐길 수 있도록 42인치 대형벽걸이 TV와 Stand형 PAVV TV, DVD, 컴퓨터, 홈시어터 등의 시설을 설치하여 고객을 정성껏 맞이하고 있다. 이처럼 캘리포니아호텔은 격조 높은 객실과 편리한 부대시설을 갖추고 있으며 고객에게 서비스를 제공하고 있다.",서울특별시 송파구 송파대로28길 11,37.4940939,127.1191073
누와 [한국관광 품질인증/Korea Quality],"한옥에서 차도 마시고, 피로도 풀고",960,0504-0904-2313,"독채한옥, 서울숙소, 서울여행, 서울한옥, 조식가능, 품질인증업소_전체보기, 한국관광품질인증, 한국관광품질인증_한옥, 한옥","누와는 서울 경복궁 서쪽 서촌마을 주택가 깊숙한 곳에 있는 원룸 독채의 작은 한옥이다. 한옥 전면을 통창으로 내 시원하고, 거실에는 다도를 할 수 있는 좌식 호두나무 탁자와 욕조가 놓여 있다. 고급 다기와 찻잎, 목욕용 소금도 준비되어 있다. 여행 후 족욕이나 반신욕을 하며 피로를 풀기에 좋다. 누와만의 특별한 공간 침실에는 침대와 맞붙은 벽에 둥근 만월창이 있어 정원과 인왕산 끝자락을 볼 수 있다.",서울특별시 종로구 필운대로5나길 3-1,37.5795666,126.9677882
호텔PJ,이색적인 패키지로 더욱 즐거운 호캉스,945,02-2280-7000,"가족과함께, 서울숙소, 서울여행, 서울호텔, 숙박, 연인과함께, 중구, 친구와함께, 호캉스, 호텔","호텔 피제이가 위치한 을지로 4가 지역은 지하철 2,3,4,5호선은 물론 다양하고 편리한 대중교통과 인접해 있어 명동, 남대문, 동대문, 남산, 인사동, 홍대, 대학로등 접근성이 뛰어나 관광 및 쇼핑이 자유롭다. 총 272개의 객실을 보유하고 있으며 레스토랑, 카페, 대연회장 및 중소연회장, 비즈니스 센터등의 부대시설을 운영하고 있다.",서울특별시 중구 마른내로 71,37.5653002,126.9956651
프레지던트 호텔,1973년 1월 개관이래 국내 호텔 문화를 선도해나가고 있는 호텔,937,02-753-3131,"서울숙소, 숙박, 중구, 프레지던트호텔, 호캉스, 호캉스즐기기","프레지던트 호텔은 서울 중심부인 ''서울광장 ''앞에 위치하고 있으며 호텔 주변의 고궁, 금융, 비즈니스, 쇼핑거리는 고객의 관광의 편리함과 성공적인 비즈니스를 보장해 준다.
비즈니스 센터, 투어 데스크 등이 있으며 리셉션을 24시간 운영하고 있고 드라이클리닝 서비스, 룸서비스 등을 이용할 수 있다. 전체 303개의 객실이 있으며 스탠다드부터 스위트까지 다양한 객실이 마련되어 있다. 또한, 객실에 따라 시청 또는 남산 조망을 감상할 수 있다.",서울특별시 중구 을지로12길 16,37.5655978,126.9909764
롯데호텔 L7 강남,감각적인 도시의 문화를 닮은 L7 강남,928,02-2077-1000,"L7강남, 강남구, 강남호텔, 롯데호텔, 롯데호텔L7, 롯데호텔L7강남, 서울숙소, 숙박","롯데호텔 L7 강남은 비즈니스 호텔로 서울 강남의 중심에 위치해있으면서 동시에 서울 MICE중심인 코엑스와도 인접해있어, 국내외 참가자들에게 편의를 제공해오고 있다. 그 밖에도 레스토랑&바 ''플로팅''에서는 특급요리사들이 한껏 솜씨를 발휘한 제철 식재료로 건강한 식사와 스낵으로 고객의 취향을 사로잡을 것이다. 그리고 투숙객이라면 누구에게나 제공가능한 풋스파가 갖춰진 야외 테라스, 테크노짐(Technogym) 사의 최신 운동기구가 갖춰진 피트니스센터, 지하주차시설, 회의장을 갖추고 있다.
L7 강남은 롯데호텔의 라이프스타일 호텔로서 트렌디함과 편안한 베딩시스템으로 비즈니스고객에게 도심속의 여유를 제공한다. 객실비용은 절감하되 서비스의 질은 높여 고객의 만족도를 높이는데 주력하고 있다.",서울특별시 강남구 테헤란로 415,37.5057015,127.0515509
